title_name,title_english,url,score_label,description,episodes,aired,premiered,genres
Hakuouki,Hakuoki ~Demon of the Fleeting Blossom~,https://myanimelist.net/anime/6895/Hakuouki,7.36,"In 1864 Japan, a young woman named Chizuru Yukimura is searching for her missing father, Koudou, a doctor by trade whose work often takes him far from home. But with no word from him in months, Chizuru disguises herself as a man and heads to Kyoto in search of him. Attracting the attention of ronin, she tries to hide and ends up witnessing a horrifying sight: the ronin being brutally murdered by crazed white-haired men. In a startling turn of events, members of the Shinsengumi arrive to dispatch the creatures. But Chizuru's safety doesn't last long, as this group of men tie her up and take her back to their headquarters, unsure of whether to let her live or silence her permanently.

However, once she reveals the name of her father, the Shinsengumi decide to keep her safe, as they too have been searching for him. But Koudou is more connected to the Shinsengumi than they let on, and soon Chizuru finds herself embroiled in a conflict between the Shinsengumi and their enemies, as well as political tension in Kyoto.

[Written by MAL Rewrite]",12,"Apr 4, 2010 to Jun 20, 2010",Spring 2010,"['Action', 'Drama', 'Supernatural', 'Historical', 'Samurai', 'Josei']"
Hataraku Saibou!!,Cells at Work!!,https://myanimelist.net/anime/39586/Hataraku_Saibou,7.36,"The cells of the human body never rest for too long; there's always something new to do and learn every day. At least, that's what Hakkekkyuu U-1146 feels as he rushes to and fro, searching for any pathogens that could cause harm to the body. Despite his dangerous line of work, it's all worth it to protect the happy smiles of Sekkekkyuu AE3803, the platelet crew, his fellow neutrophils, and the other cells he meets along the way. 

In his latest pathogen-hunting adventures, Hakkekkyuu U-1146 discovers how important cells can sometimes make mistakes, and that not all bacteria are actually bad. Everybody has their bad days, but everything eventually works out when their comrades have their backs. In the end, it's just another normal day for these hardworking cells!

[Written by MAL Rewrite]",8,"Jan 9, 2021 to Feb 27, 2021",Winter 2021,"['Comedy', 'Anthropomorphic', 'Educational', 'Medical', 'Shounen']"
High School DxD BorN: Ishibumi Ichiei Kanzen Kanshuu! Mousou Bakuyou Kaijo Original Video,High School DxD BorN Specials,https://myanimelist.net/anime/31326/High_School_DxD_BorN__Ishibumi_Ichiei_Kanzen_Kanshuu_Mousou_Bakuyou_Kaijo_Original_Video,7.36,Specials included with the Blu-ray/DVD volumes.,6,"Jul 24, 2015 to Jan 27, 2016",,"['Comedy', 'Ecchi']"
High School DxD BorN: Ishibumi Ichiei Kanzen Kanshuu! Mousou Bakuyou Kaijo Original Video,High School DxD BorN Specials,https://myanimelist.net/anime/31326/High_School_DxD_BorN__Ishibumi_Ichiei_Kanzen_Kanshuu_Mousou_Bakuyou_Kaijo_Original_Video,7.36,Specials included with the Blu-ray/DVD volumes.,6,"Jul 24, 2015 to Jan 27, 2016",,"['Comedy', 'Ecchi']"
Hiyoko no Basket Movie: Last Game 0401,,https://myanimelist.net/anime/35327/Hiyoko_no_Basket_Movie__Last_Game_0401,7.36,"2017 April Fools' Day event where the Kuroko's Basketball bird mascots fill in for the characters in a trailer for the Last Game movie.

(Source: ANN)",1,"Apr 1, 2017",,"['Sports', 'Parody']"
Honoo no Toukyuuji: Dodge Danpei,,https://myanimelist.net/anime/2228/Honoo_no_Toukyuuji__Dodge_Danpei,7.36,"Danpei Ichihgeki is the son of Daijurou Ichigeki, a great dodgeball player. As his father, Danpei gives all he has for this game and so it shows in every match.

(Source: AnimeNfo)",47,"Oct 14, 1991 to Sep 21, 1992",Fall 1991,"['Comedy', 'Sports', 'School', 'Team Sports', 'Kids']"
Isekai Quartet 2,,https://myanimelist.net/anime/39988/Isekai_Quartet_2,7.36,"Despite completing all the tasks given to them, Ainz Ooal Gown, Tanya Degurechaff, Kazuma Satou, Subaru Natsuki, and the other members of Class 2 are surprised to find out that their role as students is far from over. With no means of returning home, the class of eccentric personalities is still mysteriously stuck in the unfamiliar world. Although, as they are becoming quite fond of each other, spending more time together does not sound that bad.

With the unexpected arrival of new transfer students, the comedic antics of our beloved characters continue to grow. Thus, their bizarre yet nonchalant school life continues.

[Written by MAL Rewrite]",12,"Jan 15, 2020 to Apr 1, 2020",Winter 2020,"['Comedy', 'Fantasy', 'Isekai', 'Parody']"
Sora no Otoshimono: Project Pink,Heaven's Lost Property OVA,https://myanimelist.net/anime/7858/Sora_no_Otoshimono__Project_Pink,7.36,"The gang goes to an indoor swimming pool for some fun in the sun.  As expected, all hell breaks loose when Tomoki goes on one of his perverted missions.

Meanwhile, Nymph is having some issues with the loss of her master and considers asking Tomoki to be her replacement master.

This episode was not aired on TV because it was deemed too dangerous...",1,"Sep 9, 2010",,"['Comedy', 'Fantasy', 'Sci-Fi', 'Ecchi', 'Harem', 'Shounen']"
Soukyuu no Fafner: Dead Aggressor - The Beyond Part 3,,https://myanimelist.net/anime/41714/Soukyuu_no_Fafner__Dead_Aggressor_-_The_Beyond_Part_3,7.36,Episodes 7-9 of the Soukyuu no Fafner: Dead Aggressor - The Beyond series.,3,"Nov 13, 2020",,"['Action', 'Drama', 'Sci-Fi', 'Mecha', 'Military']"
Tales of Zestiria: Doushi no Yoake,Tales of Zestiria: Dawn of the Shepherd,https://myanimelist.net/anime/24459/Tales_of_Zestiria__Doushi_no_Yoake,7.36,TV anime special of Bandai Namco Games' Tales of Zestiria role-playing game.,1,"Dec 30, 2014",,['Fantasy']
Tennis no Oujisama: Sonzoku Yama no Hi,Prince of Tennis: A Day of the Survival Mountain,https://myanimelist.net/anime/1190/Tennis_no_Oujisama__Sonzoku_Yama_no_Hi,7.36,"The Seishun Academy Boys' Tennis team have gone off to the S.K.B Tennis Club for a one-day boot camp. The infamous ""training from Hell"" first tests the members as they run all the way up toward the mountainside club. Shortly after, they participate in specialized tennis practice that matches their specific playstyles. With the threat of Sadaharu Inui's new ""Marvelous Surprise Inui Juice Excellent"" awaiting any who fail to complete their daily tasks, the boys persevere through their exhaustion. 

A group of ill-mannered university students also arrive at the resort and demand to use the courts initially reserved for Seishun. Annoyed by their arrogance, Ryouma Echizen single-handedly challenges them to a match, with the winner claiming the right to the courts. Can the young freshman ""super rookie"" defeat the pompous team by himself?

[Written by MAL Rewrite]",1,2003,,"['Sports', 'Shounen']"
Tiger & Bunny Movie 1: The Beginning,Tiger & Bunny Movie 1,https://myanimelist.net/anime/12015/Tiger___Bunny_Movie_1__The_Beginning,7.36,"The first of two Tiger and Bunny movies, based on the first two episodes of the TV series with additional new scenes.",1,"Sep 22, 2012",,"['Action', 'Comedy', 'Mystery', 'Adult Cast', 'Super Power']"
Touhou Niji Sousaku Doujin Anime: Musou Kakyou,,https://myanimelist.net/anime/9874/Touhou_Niji_Sousaku_Doujin_Anime__Musou_Kakyou,7.36,"In the hidden magical land of Gensokyo, shrine maiden Reimu Hakurei constantly makes sure that supernatural incidents involving mythical creatures known as youkai remain as infrequent as possible. As part of her shrine's traditions, she hosts an annual summer banquet that invites a variety of guests, ranging from humans to even the strongest of youkai.

On the morning of the banquet, however, the shrine's donation box suddenly goes missing. Furthermore, there appears to be no trace of any theft whatsoever. As Reimu, her friend Marisa Kirisame, and news reporter Aya Shameimaru investigate the situation, they realize that others also have missing possessions. With each step closer to piecing the puzzle together, the group soon understands that this phenomenon is more than just simple thievery—an incident on par with Remilia Scarlet's mist or Yuyuko Saigyouji's youkai cherry blossom.

[Written by MAL Rewrite]",Unknown,"Dec 29, 2008 to ?",,"['Fantasy', 'Vampire']"
Uchuu no Stellvia,Stellvia,https://myanimelist.net/anime/113/Uchuu_no_Stellvia,7.36,"In the year 2167, a wave of radiation released by the supernova of the nearby star Hydrus Beta caused cataclysmic damage on Earth, leaving millions dead. Now, it is the year 2356. United to rebuild Earth, humanity prepares for the supernova's second wave of destruction. 

In order to protect the planet from future harm, massive space colonies called ""Foundations"" have been built throughout the Solar System. Acting as centers for both knowledge and exploration, it is at one of these Foundations—the Stellvia—that Shima Katase applies to be a preparatory student against her mother's wishes, aspiring to see space directly with her own eyes.

At the Stellvia, Katase trains to become a pilot and hopes to be selected for the ""Great Mission"" to shield Earth from the second wave. While she struggles with both her pilot classes and her tumultuous social life, she slowly grows into someone who might just be able to protect humanity.

[Written by MAL Rewrite]",26,"Apr 3, 2003 to Sep 25, 2003",Spring 2003,"['Action', 'Romance', 'Sci-Fi', 'Mecha', 'Space']"
Yowamushi Pedal: Re:Ride,Yowapeda Re:RIDE,https://myanimelist.net/anime/25755/Yowamushi_Pedal__Re_Ride,7.36,"A retelling of the first season, taking place at Toudou's family inn where he, Makishima, and Onoda reflect on the events.",1,"Sep 19, 2014",,"['Sports', 'Racing', 'Shounen']"
Zoids,,https://myanimelist.net/anime/763/Zoids,7.36,"In a remote desert on the Planet Zi, a boy named Van discovers an abandoned, dilapidated facility. Inside, he finds an opaque cocoon that breaks on its own, and a dinosaur-like robot known as an ""Organoid"" emerges from the shell. Van names the creature Zeke and claims it for himself, but a group of bandits come after him to seize the Organoid. The bandits are equipped with ""Zoids,"" beast-like mechanical units that are used for combat. Van is able to fend off his pursuers by reviving and fusing with an old Zoid dubbed the ""Shield Liger.""

Van returns to the facility with Zeke in tow and finds a new cocoon. He is ecstatic that he may have obtained another Organoid, but when the cocoon breaks, a girl emerges from it instead. Unaware of her origins, the girl only remembers that her name is Fiona and that she has to locate an object called the ""Zoid Eve."" Determined to solve the mystery behind her existence, Fiona ventures out alongside Van and Zeke to uncover what the Zoid Eve truly is. The trio runs across many friends and foes in their adventure, encountering various dangers and experiencing slices of light-heartedness as they travel.

[Written by MAL Rewrite]",67,"Sep 4, 1999 to Dec 23, 2000",Fall 1999,"['Action', 'Adventure', 'Comedy', 'Sci-Fi', 'Mecha']"
Karakuri Zoushi Ayatsuri Sakon,,https://myanimelist.net/anime/2204/Karakuri_Zoushi_Ayatsuri_Sakon,7.36,"The dark-haired bishounen is Sakon Tachibana, a puppeteer, and the other is Ukon, his favorite puppet, and best friend. Sakon is the (only) grandson of Saemon Tachibana, a national treasure of Japan famous for his manipulation of Bunraku puppets. Ukon is a child doll puppet made in the early Meiji era by the famous female dollmaker Unosuke. Together they run into murders and solve them.

(Source: AnimeNfo)",26,"Oct 8, 1999 to Mar 31, 2000",Fall 1999,"['Mystery', 'Suspense', 'Detective', 'Shounen']"
Kidou Senshi Gundam SEED: SEED Supernova - Tanekyara Gekijou,,https://myanimelist.net/anime/2743/Kidou_Senshi_Gundam_SEED__SEED_Supernova_-_Tanekyara_Gekijou,7.36,"The first two shorts feature the original SEED cast and deal with an attempt by Yzak Joule to reclaim his his honor from Athrun Zala after having been one-upped at seemingly every contest with him since his childhood. The last two shorts feature the Minerva crew sent back in time on comical missions from Gil in an attempt to disrupt key events of the Seed era with disastrous yet hilarious effect.

(Source: ANN)",4,"Jun 22, 2007",,"['Comedy', 'Parody']"
Mahou no Yousei Persia,Persia the Magic Fairy,https://myanimelist.net/anime/2039/Mahou_no_Yousei_Persia,7.36,"11-year-old Persia has grown up alongside the animals on the Serengeti plains of Africa. Twins Riki and Gaku Muroi and their grandfather, Gouken, bring Persia to Japan with them, where she will live with a couple (who Persia calls Mama and Papa) that own a grocery store. During the flight to Japan, Persia finds herself in the ""Lovely Dream"" where she meets the Fairy Queen, who explains that the Lovely Dream is in danger and requests Persia's help. Giving Persia a magical headband (which can also summon a magical baton) that allows her to transform into a teenage girl, connecting her to the Lovely Dream and allowing her to use magic. She is sent with three kappa back into the regular world with the mission of collecting love energy to thaw the frozen Lovely Dream. If Persia fails her task of collecting love energy or if someone catches her using magic, Riki and Gaku will be transformed into women.

(Source: ANN)",48,"Jul 6, 1984 to May 31, 1985",Summer 1984,"['Comedy', 'Mahou Shoujo']"
Meitantei Conan OVA 06: Kieta Daiya wo Oe! Conan & Heiji VS Kid!,Detective Conan OVA 06: Follow the Vanished Diamond! Conan & Heiji vs. Kid!,https://myanimelist.net/anime/1368/Meitantei_Conan_OVA_06__Kieta_Daiya_wo_Oe_Conan___Heiji_VS_Kid,7.36,"One day Mori Kogoro's private detective agency receives a blackmail call. It turns out that the caller has dialed the wrong number. Conan is able to identify the voice on the phone, it's similar to that of his old friend Heiji, who's also a high school detective but in Osaka. They join once again forces to solve the case and find the jewel which was stolen. 

But they are not the only ones who are after the jewel. The notorious master thief Kaitou Kid has taken an interest in this piece, which is worth 100,000,000 Yen, as well and now it's up to Heiji and Conan to be the first to find the culprit and acquire the jewel. 

(Source: AniDB)",1,"Mar 15, 2006",,"['Comedy', 'Mystery', 'Detective', 'Shounen']"
Naruto x UT,,https://myanimelist.net/anime/10075/Naruto_x_UT,7.36,"All-new animation offered throughout UNIQLO clothing stores in Japan on January 1, 2011. The DVD contains an exclusive version of Mayonaka Orchestra, by the Japanese rock band Aqua Timez. A limited number of the DVDs was offered as presents to people who bought UNIQLO's Naruto graphic T-shirts online or in their stores.

(Source: ANN, edited)",1,"Jan 1, 2011",,"['Action', 'Fantasy', 'Shounen']"
Nisekoi OVA,,https://myanimelist.net/anime/24227/Nisekoi_OVA,7.36,"1. Funshitsu / Miko-san
2. Oshigoto / Henbou
3. Sentou / Service",3,"Oct 3, 2014 to Apr 3, 2015",,"['Comedy', 'Romance', 'Harem', 'School', 'Shounen']"
Nozomanu Fushi no Boukensha,The Unwanted Undead Adventurer,https://myanimelist.net/anime/51648/Nozomanu_Fushi_no_Boukensha,7.39,"Rentt Faina, a 25-year-old adventurer, has been hacking away at monsters for a decade. Without much talent for the job, Rentt finds himself stuck hunting slimes and goblins for meager amounts of coin every day. Little does he know, all this is about to change when he comes across a seemingly undiscovered path in the Water Moon Dungeon.

What awaits him at the end of the path, however, is neither treasure nor riches, but a legendary dragon that wastes no time swallowing him whole! Waking up a short time later, Rentt finds himself not quite dead, but not very alive either―He is nothing more than a pile of bones! Armed with nothing but his trusty sword, tool belt, and ghoulish new looks, Rentt sets off on his quest as a newly reborn skeleton to achieve Existential Evolution, hoping to one day return to civilization with a more human form.

Will Rentt succeed, or will the dungeon consume him for the rest of his un-death...?

(Source: J-Novel Club)",12,"Jan 8, 2024 to ?",Winter 2024,"['Action', 'Adventure', 'Fantasy']"
Prison School: Mad Wax,,https://myanimelist.net/anime/32485/Prison_School__Mad_Wax,7.36,"Hachimitsu Private Academy's five male students have been released from their oppressive prison captors, allowing them to return to their ideal school lives surrounded by short-skirted girls.

With their freedom restored, things could not be going better for the gang. Kiyoshi Fujino and Shingo Wakamoto have formed close bonds with their female classmates; Reiji Andou is the center of attention due to his masochistic quirks; and even Takehito ""Gakuto"" Morokuzu—notorious for defecating himself during class—befriends the klutzy yet like-minded Mitsuko Yokoyama. 

However, in contrast to his fellow ex-convicts, Jouji ""Joe"" Nezu struggles to readjust to student life, and the unlikely romantic success of his friend Gakuto pushes him to his wit's end. Feeling ostracized, he begins to wonder if life was better behind bars.

[Written by MAL Rewrite]",1,"Mar 4, 2016",,"['Comedy', 'Ecchi', 'Gag Humor', 'School', 'Seinen']"
Ryman's Club,Salaryman's Club,https://myanimelist.net/anime/50185/Rymans_Club,7.36,"The world of corporate badminton is not as easy as it seems. Although considered a former child prodigy, Mikoto Shiratori has not been living up to his potential as a badminton player for Mitsuhoshi Bank. Due to a past incident, Mikoto tries to transition from playing doubles to singles; nevertheless, he fails to produce positive results, much to his employer's dismay.

After being fired from the bank, Mikoto is recruited by the Sunlight Beverage corporate badminton team. Surprisingly, not only do practices start in the evening, but he also has to work in the sales department of the company by day. While this is not a novel arrangement, Mikoto had thought he was invited solely to play sports. To make matters worse, he is forced to compete in doubles despite his reluctance.

Struggling to adjust to his new professional life, Mikoto begins to doubt his decision to join the company. However, as he learns more about his latest teammates, he might just find the strength necessary to advance his badminton career.

[Written by MAL Rewrite]",12,"Jan 30, 2022 to Apr 17, 2022",Winter 2022,"['Sports', 'Adult Cast', 'Workplace']"
Ryuu no Haisha,The Dragon Dentist,https://myanimelist.net/anime/34549/Ryuu_no_Haisha,7.36,"War rages between two neighboring countries, but one side has an ace up their sleeve: an ancient dragon bound by a pact to protect the nation. Despite these overpowering creatures being capable of leveling entire battlefields, they are rendered useless by cavities. And so, a special unit—the dragon dentists—has the important duty of caring for the dragon's teeth.

Nonoko Kishii was the only one of many brave volunteers who survived a recent round of recruitment; in order to join the dragon dentists, one has to witness their future demise and accept it without a fight. Knowing the exact circumstances of their fated ends, the dragon dentists devote themselves to their work. One day, they gain a new member who did not undergo the test: Bernard ""Bel"" Octavius, a young enemy officer killed by his own men and revived by the dragon's teeth. Despite his appearance being an omen of a great disaster, he is placed under the care of Nonoko as a dentist-in-training. Will Bel come around to the dragon dentists' attitudes toward death and help them face the painful future that is to come?

[Written by MAL Rewrite]",2,"Feb 18, 2017 to Feb 25, 2017",,"['Adventure', 'Fantasy']"
s.CRY.ed,s-CRY-ed,https://myanimelist.net/anime/168/sCRYed,7.36,"A strange environmental phenomenon 22 years ago in the Kanazawa prefecture caused the land to split and protrude upwards reaching unprecedented heights, creating the secluded area known as The Lost Ground. Kazuma is a young mercenary who lives in the Lost Ground, looking for any work he can find to sustain his livelihood within the harsh environment. He is one of the few people that are gifted with the Alter ability, which allows him to plaster his right arm and torso with a metallic alloy. When this mercenary encounters HOLY, an order whose purpose is to suppress and capture what they call Native Alter Users, and one of the elite members of HOLY, Ryuho, an epic rivalry begins.

(Source: ANN)",26,"Jul 4, 2001 to Dec 26, 2001",Summer 2001,"['Action', 'Adventure', 'Drama', 'Sci-Fi', 'Super Power']"
Seto no Hanayome OVA Specials,Seto no Hanayome OVA Extras,https://myanimelist.net/anime/7041/Seto_no_Hanayome_OVA_Specials,7.36,30 seconds sketches/omakes from the OVAs.,2,"Nov 3, 2008 to Jan 5, 2009",,"['Comedy', 'Parody', 'School']"
"Shin Kimagure Orange☆Road: Soshite, Ano Natsu no Hajimari",,https://myanimelist.net/anime/2098/Shin_Kimagure_Orange☆Road__Soshite_Ano_Natsu_no_Hajimari,7.36,"It's been several years and Kyosuke Kasuga is now 19. A mysterious phone call warns him of oncoming cars but he doesn't listen. Ironically, he gets hit by a car and because of his telepathic abilities, gets sent three years into the future. His 22 year old future self is now a photographer who is lost in Bosnia and believed to be dead. Kyosuke must find his 22 year old future self and restore himself, the 19 year old, to his correct time. Along the way he reunites with Hikaru who is now a professional and famous dancer. Madoka is also there, distraught over both Kyosuke, the 22 year old, going missing in Bosnia and Kyosuke, the 19 year old, getting hit by a car. 

(Source: ANN)",1,"Nov 2, 1996",,"['Comedy', 'Drama', 'Fantasy', 'Romance', 'Slice of Life', 'Ecchi', 'Shounen']"
Shiro Seijo to Kuro Bokushi,Saint Cecilia and Pastor Lawrence,https://myanimelist.net/anime/52082/Shiro_Seijo_to_Kuro_Bokushi,7.37,"In a small church atop a hill, Pastor Lawrence looks after Saint Cecilia. Her presence is a beacon of hope for the villagers, as her mysterious powers protect them from the weakness of their minds and outside evils. While she appears dignified in front of the villagers, Cecilia allows her lazy side to show when alone with the pastor. Although Cecilia is the guardian of the people, Lawrence is determined to shield her from harm.

Unbeknownst to Lawrence, Cecilia harbors a huge crush on him. She accompanies him on his shopping trips and provides him with divine protection every day. Despite Lawrence remaining oblivious to her true feelings, Cecilia continues to shower him with obvious displays of affection as the bond between them grows.

[Written by MAL Rewrite]",12,"Jul 13, 2023 to Sep 28, 2023",Summer 2023,"['Fantasy', 'Romance', 'Shounen']"
Kaichou wa Maid-sama!: Goshujinsama to Asonjao♥,Maid Sama! Play with Your Husband ♥,https://myanimelist.net/anime/10298/Kaichou_wa_Maid-sama__Goshujinsama_to_Asonjao♥,7.35,"As she strives to be an upstanding student council president, Misaki Ayuzawa maintains the same dedication to her secret part-time job at a maid cafe. As if Misaki's everyday life is not busy enough, the people around her only make it more hectic. Each colorful member of the cast has a story to tell, expressing their personalities further by putting their own twist on familiar scenes.

[Written by MAL Rewrite]",1,"Jul 24, 2010",,"['Comedy', 'School', 'Shoujo']"
Kimagure Orange☆Road OVA,Kimagure Orange Road OVA,https://myanimelist.net/anime/2458/Kimagure_Orange☆Road_OVA,7.35,"Shiroi Koibito-tachi
Kyousuke Kasuga and his friends are staying at his grandparent's house over winter break on a skiing trip. Everyone is excited until they hear about a curse that spells doom for couples who go down the mountain together. With a net of relationships and crushes on the line, the group's plans are suddenly upended.

Hawaiian Suspense
Kyousuke and Madoka Ayukawa's trip to Hawaii takes an abrupt turn for the worse when Hikaru Hiyama gets kidnapped! Kyousuke has to find a way to rescue her without revealing his paranormal powers to Madoka.

Wagahai wa Neko de Attari Osakana de Attari
While studying for exams, Kyousuke wishes that he could switch places with his pet cat or fish so he could have an easier life. But when his grandfather arrives with a magic rope that can be used to swap bodies, Kyousuke finds out he might have gotten himself in too deep.

Hurricane! Henshin Shoujo Akane
When Kyousuke's cousin, Akane, comes to visit, she stirs up antics with her ability to cast illusions. Things get even crazier when Akane falls for Madoka and becomes Kyousuke's rival in love.

Koi no Stage=Heart on Fire!
As Kyousuke helps to prepare for a local music festival, a popular idol crashes into him and they switch bodies! Now, Kyousuke must get his body back and prevent his secret from getting out before the show begins.

Omoi Gakenai Situation
Kyousuke has a foreboding dream where Akane attempts to seduce him. Disgusted after having inappropriate thoughts about his cousin, Kyousuke is shocked when she actually asks him to pose as her boyfriend in front of her friends.

Rouge no Dengon
Madoka's father is in Japan for a performance, and she is excited for the rare opportunity to see him. When she sees her father with a strange woman, however, her emotions are thrown into disarray.

[Written by MAL Rewrite]",8,"Mar 1, 1989 to Jan 18, 1991",,"['Comedy', 'Drama', 'Romance', 'School', 'Shounen']"
