title_name,title_english,url,score_label,description,episodes,aired,premiered,genres
Kamonohashi Ron no Kindan Suiri,Ron Kamonohashi's Forbidden Deductions,https://myanimelist.net/anime/53879/Kamonohashi_Ron_no_Kindan_Suiri,7.44,"Ron Kamonohashi, the best student in the history of the elite Detective Training Academy BLUE, has been living as a recluse since BLUE expelled him five years ago. Moreover, he is forbidden to work as a detective, having barely escaped execution after getting involved in a murder case while he was still attending the school. Ron's situation changes drastically when police detective Totomaru Isshiki, following the advice of a senior colleague, seeks him out for help with a criminal case that has remained unsolved for months. Ron reluctantly agrees to help Totomaru and uses his phenomenal intuition to discover the culprit in less than a day. However, it appears that Ron suffers from a mysterious condition that can cause those around him to lose their lives. To Ron's great surprise, Totomaru manages to save the life of someone whom Ron put in jeopardy.

As the unlikely duo starts solving crimes one after another, BLUE sends operatives after its former student to find out if he has resumed investigative work. Fighting against murderers, rogue detectives, and the Metropolitan Police Department, Ron and Totomaru must join forces if they want to survive and see justice prevail.

[Written by MAL Rewrite]",13,"Oct 2, 2023 to Dec 25, 2023",Fall 2023,"['Comedy', 'Mystery', 'Adult Cast', 'Detective', 'Shounen']"
Kengan Ashura,,https://myanimelist.net/anime/36903/Kengan_Ashura,7.44,"Business deals are usually made through meetings and contracts; but in the world of Kengan Ashura, businesses resort to other means to make their decisions: by hiring gladiators. Yabako Sandrovich's Kengan Ashura depicts a world brimming with action, violence, and martial arts—one where powerful gladiators have fought in grand arenas since the Edo Period to settle the disputes of wealthy businesses and merchants.

Ouma Tokita, who is nicknamed ""The Ashura,"" is a fighter trying to prove himself as the strongest. Hideki Nogi, a member of the Nogi Group, hires Ouma to fight for him and makes Kazuo Yamashita, an average middle-aged man, his manager. The duo is thrown into fights facilitated by the Kengan Association. Their journey will be full of ruthless battles with other fighters aiming for the same goal. Do they have what it takes to be the best?

[Written by MAL Rewrite]",12,"Jul 31, 2019",,"['Action', 'Gore', 'Martial Arts']"
"Kumo no Mukou, Yakusoku no Basho",The Place Promised in Our Early Days,https://myanimelist.net/anime/433/Kumo_no_Mukou_Yakusoku_no_Basho,7.44,"Hiroki Fujisawa and Takuya Shirakawa harbor admiration for two things in their life: their classmate Sayuri Sawatari and the vast Ezo Tower that stands boundlessly across the Tsugaru Strait. Fascinated by the limitless structure beyond their reach, Hiroki and Takuya begin constructing an aeroplane from a fallen drone they discovered—naming it the Bella Ciela—to fulfill their dream of one day reaching the sky-scraping top of the tower. Later joined by the girl they love, Hiroki and Takuya promise Sayuri to fly with her to the seemingly otherworldly top together. However, Japan has suffered a North-South partitioning that has fueled conflict near the base of the tower, which marks the border between the America-controlled Southern islands and the Northern lands occupied by the Soviet Union.

Further along, Sayuri suddenly disappears, and Hiroki and Takuya never see her again. Unbeknownst to them, she fell victim to a sleeping disorder that left her comatose for the past three years. Although Hiroki and Takuya later learn about Sayuri's condition, they also discover that the girl's unconscious state is oddly linked to the same tower the trio had promised to conquer together.

[Written by MAL Rewrite]",1,"Nov 20, 2004",,"['Award Winning', 'Drama', 'Romance', 'Sci-Fi', 'Military']"
Kyuuketsuki Sugu Shinu 2,The Vampire Dies in No Time Season 2,https://myanimelist.net/anime/50287/Kyuuketsuki_Sugu_Shinu_2,7.44,Second season of Kyuuketsuki Sugu Shinu.,12,"Jan 9, 2023 to Mar 27, 2023",Winter 2023,"['Comedy', 'Supernatural', 'Adult Cast', 'Gag Humor', 'Vampire', 'Shounen']"
Mahou Shoujo Lyrical Nanoha: Reflection,Magical Girl Lyrical Nanoha Reflection,https://myanimelist.net/anime/17947/Mahou_Shoujo_Lyrical_Nanoha__Reflection,7.44,"The dying planet of Eltria is the only home of Kyrie Florian, her older sister Amitie, and her parents, who are scientists researching ways to save it. Unfortunately, the Florians must leave the planet behind to seek medical care for their father, who has contracted a lethal illness.

Even with treatment, the survival rate of Kyrie's father is minuscule. Refusing to give up on her father and Eltria, Kyrie goes against the wishes of her sister and runs away from home to the peaceful planet of Earth in search of a solution. There, Kyrie and her childhood friend, Iris, pursue Earth's magical protectors—Nanoha Takamachi, Fate Testarossa, and Hayate Yagami.

Nanoha and her companions possess the key to fulfilling Kyrie's objective, and the young girl must do whatever it takes to obtain it. However, it proves difficult for Kyrie, as the protectors do not easily yield to her provocation. Furthermore, Amitie soon arrives on Earth to stop her younger sister's reckless actions and bring her back home, further complicating the already delicate situation.

[Written by MAL Rewrite]",1,"Jul 22, 2017",,"['Action', 'Drama', 'Sci-Fi', 'Mahou Shoujo']"
Mahoutsukai Precure! Movie: Kiseki no Henshin! Cure Mofurun!,,https://myanimelist.net/anime/33183/Mahoutsukai_Precure_Movie__Kiseki_no_Henshin_Cure_Mofurun,7.44,Toei Animation has announced that a movie for Mahoutsukai! Precure will premiere in October 2016.,1,"Oct 29, 2016",,"['Action', 'Fantasy', 'Slice of Life', 'Mahou Shoujo', 'School']"
Omoide Poroporo,Only Yesterday,https://myanimelist.net/anime/1029/Omoide_Poroporo,7.44,"Taeko Okajima is a 27-year-old, independent woman who spent her entire life in Tokyo. Looking to unwind from the rush of the big city, she decides to visit her family in the country to help out during the harvest.

On the train there, Taeko vividly recalls her memories as a schoolgirl in the initial stages of puberty, as if she is on a trip with her childhood self. A young farmer named Toshio picks her up at the station, and they quickly develop a friendship. During her stay, Taeko forms strong bonds with family and friends, learning the contrasts between urban and rural life, as well as the struggles and joys of farming.

Nostalgic and bittersweet, Omoide Poroporo takes on Taeko's journey as an adult woman coming to terms with her childhood dreams compared to the person she is today.

[Written by MAL Rewrite]",1,"Jul 20, 1991",,"['Drama', 'Romance', 'Josei']"
"One Piece Movie 09: Episode of Chopper Plus - Fuyu ni Saku, Kiseki no Sakura","One Piece: Episode of Chopper Plus - Bloom in the Winter, Miracle Sakura",https://myanimelist.net/anime/3848/One_Piece_Movie_09__Episode_of_Chopper_Plus_-_Fuyu_ni_Saku_Kiseki_no_Sakura,7.44,"As Nami has fallen seriously ill, the Straw Hats head to Drum Island in search of a doctor. However, they learn that there is only one doctor left on the island, the reclusive Dr. Kureha who currently resides at the top of a mountain. With a sick Nami in tow, Monkey D. Luffy and Sanji set out on an arduous journey to seek her help. 

Meanwhile, the return of Wapol—Drum Island's former king—and his brother spells trouble for the island's inhabitants. As the one responsible for the current lack of doctors, Wapol has finally returned to take back his position as the people's despot and absolute ruler.

With the help of new allies like the half-human reindeer Chopper Tony Tony, the Straw Hat Crew must overcome all the obstacles in its way to save Nami's life and stop Wapol from plunging Drum Island back into tyranny. 

[Written by MAL Rewrite]

(Source: Wikipedia)",1,"Mar 1, 2008",,"['Action', 'Adventure', 'Fantasy', 'Shounen']"
Pokemon (2023),Pokémon Horizons: The Series,https://myanimelist.net/anime/53876/Pokemon_2023,7.44,"In a world filled with strange yet majestic creatures known as Pokémon, a new adventure begins! Hailing from the pristine region of Paldea, the timid Liko travels to the Kanto region to attend the Indigo Academy and become a Pokémon trainer—a person who forms relationships with Pokémon and trains them to participate in battles. Soon, Liko acquires Nyahoja, a fickle Grass-type cat Pokémon, as her first partner.

Prior to Liko's transfer to Kanto, her grandmother gives her a uniquely patterned and gleaming pendant as a protective charm. However, an enigmatic organization—The Explorers—seems to know a secret about the pendant and nearly succeeds in stealing it from Liko. Fortunately, she is rescued by the Rising Volt Tacklers, a group of adventurers led by a Lizardon-riding trainer named Friede.

After a series of encounters with The Explorers, Liko decides to join Friede's team, accompanying him and his crew members on a grand journey across the regions. Along the way, they aim to unravel not only the mysteries of the world of Pokémon, but also the power that resides within her pendant.

[Written by MAL Rewrite]",Unknown,"Apr 14, 2023 to ?",Spring 2023,"['Action', 'Adventure', 'Comedy', 'Fantasy', 'Kids']"
Psycho-Pass 3,,https://myanimelist.net/anime/39491/Psycho-Pass_3,7.44,"Thanks to the Sibyl System, the mental states of society can now be measured on a numerical scale. Using these ""crime coefficients,"" a culprit can be apprehended before they ever commit a crime. But is it a perfect system? For Inspectors Kei Mikhail Ignatov and Arata Shindou, that remains to be seen, as their career with the Public Safety Bureau's Crime Investigation Department has only just begun. 

Shindou and Ignatov are assigned to investigate the crash of a ship carrying immigrants, but they begin to suspect that it was no mere accident. Meanwhile, a mysterious group called Bifrost is observing them from the shadows, but they are not the only ones who have taken an interest in the two new Inspectors.

[Written by MAL Rewrite]",8,"Oct 25, 2019 to Dec 13, 2019",Fall 2019,"['Action', 'Mystery', 'Sci-Fi', 'Suspense', 'Adult Cast', 'Detective', 'Gore', 'Psychological']"
Rakudai Kishi no Cavalry,Chivalry of a Failed Knight,https://myanimelist.net/anime/30296/Rakudai_Kishi_no_Cavalry,7.44,"There exist few humans in this world with the ability to manipulate their souls to form powerful weapons. Dubbed ""Blazers,"" these people study and train at the prestigious Hagun Academy to become Mage-Knights; among the students is so-called failure Ikki Kurogane, the sole F-rated Blazer. However, when the worst student in the academy sees Stella Vermillion, an A-ranked Blazer who also happens to be a princess, naked, she challenges him to a duel with dire stakes—the loser becomes the slave of the winner. There's no possible way that Stella can lose, right?

As he tries to prove his strength to a world that believes him to be the weakest, Ikki gains new friends, wisdom, and experience.

[Written by MAL Rewrite]",12,"Oct 3, 2015 to Dec 19, 2015",Fall 2015,"['Action', 'Fantasy', 'Romance', 'Ecchi', 'School']"
Saihate no Paladin: Tetsusabi no Yama no Ou,The Faraway Paladin: The Lord of the Rust Mountains,https://myanimelist.net/anime/50664/Saihate_no_Paladin__Tetsusabi_no_Yama_no_Ou,7.44,Second season of Saihate no Paladin.,12,"Oct 7, 2023 to Dec 23, 2023",Fall 2023,"['Action', 'Adventure', 'Fantasy', 'Isekai', 'Reincarnation']"
Samurai 7,,https://myanimelist.net/anime/166/Samurai_7,7.44,"In the far distant future, on a planet that might have been called ""earth"", there was a war between samurai who mechanized their bodies. After the long war, people enjoyed a modest peace.

Facing starvation and abductions at the hands of fearsome mechanized bandits (Nobuseri), the farmers of Kanna Village make the dangerous choice to hire samurai for protection. The village's water priestess, Kirara, her younger sister, Komachi, and a heartbroken villager, Rikichi, set off to hire willing samurai with nothing to offer but rice from their meager harvests. Through dangerous encounters and a bit of luck, seven samurai of varying specialties and experience are gathered for an epic battle against the bandits and the merchants that influence them.

Samurai 7 is based loosely upon Kurosawa Akira's famous movie ""Seven Samurai""/""Shichinin no Samurai""",26,"Jun 12, 2004 to Dec 25, 2004",Summer 2004,"['Action', 'Sci-Fi', 'Historical', 'Mecha', 'Samurai']"
Senki Zesshou Symphogear GX,Symphogear GX,https://myanimelist.net/anime/21573/Senki_Zesshou_Symphogear_GX,7.44,"Following the events of Senki Zesshou Symphogear G, Hibiki Tachibana, Tsubasa Kazanari, and Chris Yukine continue to operate under the command of Genjuurou Kazanari. Meanwhile, Maria Cadenzavna Eve, Kirika Akatsuki, and Shirabe Tsukuyomi are taken into protective custody. With peace restored, everyone returns to their daily lives; however, the appearance of the alchemist Carol Malus Dienheim and her subordinates—the ""Autoscorers""—threatens to draw everyone back into a conflict. 

Armed with a strange and magical power, Carol wishes to initiate the apocalypse and bring destruction to the world... and she is willing to sacrifice everything to do so. Against this mysterious new foe, the six Symphogear wielders must rise to the challenge in order to protect what they hold dear. However, will Carol and her Autoscorers prove to be too much to handle in this fight to protect the fate of the world?

[Written by MAL Rewrite]",13,"Jul 4, 2015 to Sep 26, 2015",Summer 2015,"['Action', 'Sci-Fi', 'Idols (Female)', 'Music']"
3-nen Z-gumi Ginpachi-sensei Announcement Special,,https://myanimelist.net/anime/54761/3-nen_Z-gumi_Ginpachi-sensei_Announcement_Special,7.43,Announcement for 3-nen Z-gumi Ginpachi-sensei.,1,"Mar 19, 2023",,['Comedy']
Aishiteruze Baby★★,,https://myanimelist.net/anime/102/Aishiteruze_Baby★★,7.44,"Katakura Kippei is in every way a high school playboy. Spending his days flirting with any girl he can see, responsibility is the last thing on his mind. Life takes an unexpected turn for him as one day he returns home to find himself with the full-time task of caring for his 5-year-old cousin. Kippei's aunt Miyako had disappeared, appearing to have abandoned his cousin, Yuzuyu. With Kippei's lack of responsibility and knowledge of childcare and Yuzuyu's injured heart with the disappearance of her mother, their time together is in for a bumpy ride.",26,"Apr 3, 2004 to Oct 9, 2004",Spring 2004,"['Comedy', 'Drama', 'Romance', 'Childcare', 'Shoujo']"
Crayon Shin-chan Movie 10: Arashi wo Yobu Appare! Sengoku Daikassen,,https://myanimelist.net/anime/3744/Crayon_Shin-chan_Movie_10__Arashi_wo_Yobu_Appare_Sengoku_Daikassen,7.44,"A full-scale historical drama set in the last days (the year 1574) of the Sengoku Era of feudal Japan. It is the story of the Nohara family, who has been transferred into the Sengoku Era by time warp, and a tragic love between a princess Ren Kasuga (a daughter of the feudal lord Kasuga at the Province of Musashi) and a samurai warrior Matabei Ijiri (a retainer of the Lord Kasuga).

(Source: Manabu Tsuribe)",1,"Apr 20, 2002",,"['Award Winning', 'Drama', 'Romance', 'Historical', 'Samurai', 'Seinen']"
Crayon Shin-chan Movie 18: Chou Jikuu! Arashi wo Yobu Ora no Hanayome,,https://myanimelist.net/anime/8369/Crayon_Shin-chan_Movie_18__Chou_Jikuu_Arashi_wo_Yobu_Ora_no_Hanayome,7.44,"Comical action adventure film set in the future world, like a dystopian science fiction. Shinnosuke's future fiancee, Tamiko Kaneari comes from the future via the time machine. She says her father Masuzo Kaneari captures adult Shinnosuke in the future world and they needs the power of Shinnosuke at age 5 to rescue him. She takes Shinnosuke and Kasukabe Defense Forces members to the future big city Neotokio, which is the world ruled by Masuzo Kaneari, the president of the electric power company Kaneari Electric. 

(Source: Manabu Tsuribe)",1,"Apr 17, 2010",,"['Adventure', 'Comedy', 'Sci-Fi', 'Seinen']"
Days: Touin Gakuen-sen!,,https://myanimelist.net/anime/34513/Days__Touin_Gakuen-sen,7.44,"Sequel to DAYS.

The final match against Touyin Gakuin for National High School Soccer Tournament Tokyo Preliminary.

(Source: MAL News)",3,"Mar 16, 2018 to Jul 17, 2018",,"['Sports', 'School', 'Team Sports', 'Shounen']"
Digimon Adventure tri. 2: Ketsui,Digimon Adventure tri. Determination,https://myanimelist.net/anime/32108/Digimon_Adventure_tri_2__Ketsui,7.44,"Infected Digimon—digital monsters who have begun acting in a berserk manner and experiencing a bizarre increase in power—are invading the real world. While Maki Himekawa and Daigo Nishijima, agents of the mysterious Incorporated Administrative Agency, attempt to learn more about these disruptive appearances, most of the Chosen Children are busy preparing for Tsukishima General High School's summer festival.

Mimi Tachikawa, having recently returned to Japan after living in the United States for years, struggles to find her footing among her classmates and fellow Chosen Children. Meanwhile, by throwing himself into his studies, Jou Kido has been deliberately avoiding all issues related to Digimon, causing his partner Gomamon to run away. Mimi and Jou's individual actions cause friction within the group even as the threat of infected Digimon still looms over them. Will the two resolve their personal conflicts in time to help their friends fight off the latest threat?

[Written by MAL Rewrite]",1,"Mar 12, 2016",,"['Action', 'Adventure', 'Comedy', 'Drama']"
Dragon Ball Super,,https://myanimelist.net/anime/30694/Dragon_Ball_Super,7.44,"Seven years after the defeat of Majin Buu, Earth is at peace, and its people live free from any dangers lurking in the universe. However, this peace is short-lived; a sleeping threat awakens in the dark reaches of the galaxy: Beerus, the ruthless God of Destruction.

Disturbed by a prophecy that he will be defeated by a ""Super Saiyan God,"" Beerus and his angelic attendant Whis search the universe for this mysterious being. Before long, they reach Earth and encounter Gokuu Son, one of the planet's mightiest warriors, and his powerful friends.

[Written by MAL Rewrite]",131,"Jul 5, 2015 to Mar 25, 2018",Summer 2015,"['Action', 'Adventure', 'Comedy', 'Fantasy', 'Martial Arts', 'Super Power', 'Shounen']"
Gabriel DropOut,,https://myanimelist.net/anime/33731/Gabriel_DropOut,7.44,"For centuries, Heaven has required its young angels to live and study among humans in order to become full-fledged angels. This is no different for top-of-her-class Gabriel White Tenma, who believes it is her mission to be a great angel who will bring happiness to mankind. However, Gabriel grows addicted to video games on Earth and eventually becomes a hikikomori. Proclaiming herself a ""Fallen Angel,"" she is apathetic to everything else—much to the annoyance of Vignette April Tsukinose, a demon whom Gabriel befriended in her angelic early days on Earth.

Vignette's attempts to revert Gabriel back to her previous self are in vain, as Gabriel shoots down any attempt to change her precious lifestyle. As they spend their time on Earth, they meet two eccentric personalities: the angel Raphiel Ainsworth Shiraha, Gabriel's classmate with a penchant for sadism, and the demon Satanichia McDowell Kurumizawa, a clumsy self-proclaimed future ruler of the Underworld.

Gabriel DropOut follows these four friends' comedic lives as they utterly fail to understand what it truly means to be a demon or an angel.

[Written by MAL Rewrite]",12,"Jan 9, 2017 to Mar 27, 2017",Winter 2017,"['Comedy', 'Supernatural', 'CGDCT', 'Mythology', 'School', 'Shounen']"
Genjitsu Shugi Yuusha no Oukoku Saikenki Part 2,How a Realist Hero Rebuilt the Kingdom Part 2,https://myanimelist.net/anime/49930/Genjitsu_Shugi_Yuusha_no_Oukoku_Saikenki_Part_2,7.44,"Together with his talented aides, the ""Realist Hero"" Kazuya Souma continues his quest of reinvigorating the Elfrieden Kingdom through administrative reform. Having successfully conquered Van—the capital city of the Principality of Amidonia—Kazuya now faces the envoy from Gran Chaos Empire, who wishes to impose punishment for breaching the ban on war established by the Mankind Declaration Treaty. Despite the dire situation, Kazuya sees a path to avoid unnecessary conflict whilst gaining new allies. With his plan being seemingly perfect, the only barrier to success is gaining approval from the envoy.

[Written by MAL Rewrite]",13,"Jan 9, 2022 to Apr 3, 2022",Winter 2022,"['Action', 'Fantasy', 'Romance', 'Harem', 'Isekai', 'Military']"
Haiyore! Nyaruko-san F,,https://myanimelist.net/anime/26023/Haiyore_Nyaruko-san_F,7.44,"A new OVA of the light novel Haiyore! Nyaruko-san, titled Haiyore! Nyaruko-san F, has been green-lit.

(Source: MAL News)",1,"Jun 19, 2015",,"['Comedy', 'Romance', 'Sci-Fi', 'Parody']"
Hetalia World Series Specials,Hetalia World Series Extra Episodes,https://myanimelist.net/anime/10497/Hetalia_World_Series_Specials,7.44,"Extra episodes of Hetalia World Series. 

Includes:
- Hetalia Extra 1: Chatty Nordics
- Hetalia Extra 2: Celebrating Halloween
- Hetalia Extra 3: Previously in Hetalia
- Hetalia Extra 4: Hetalia = Fantasia",4,"Mar 25, 2011 to Sep 24, 2012",,"['Comedy', 'Historical', 'Parody']"
Initial D Battle Stage 3,,https://myanimelist.net/anime/47410/Initial_D_Battle_Stage_3,7.44,"Initial D: Battle Stage 3 is the eleventh and final installment of the Initial D series. It features every race from Fifth Stage and Final Stage. Unlike the previous two battle stages, it does not feature any new battles, and doesn't feature any character dialogue.

(Source: Initial D Wiki)",1,"Mar 5, 2021",,"['Action', 'Racing']"
K: Seven Stories Movie 4 - Lost Small World - Ori no Mukou ni,"K: SEVEN STORIES ""Lost Small World - Outside the Cage - """,https://myanimelist.net/anime/37305/K__Seven_Stories_Movie_4_-_Lost_Small_World_-_Ori_no_Mukou_ni,7.44,"Misaki Yata is a youth whose reckless and immature attitude has led him to be shunned by his classmates. Saruhiko Fushimi is a loner who views the world in a pessimistic way. Despite being polar opposites, the two become the best of friends.

(Source: TubiTV)",1,"Oct 6, 2018",,"['Action', 'Supernatural', 'Super Power']"
Sidonia no Kishi: Ai Tsumugu Hoshi,Knights of Sidonia: Love Woven in the Stars,https://myanimelist.net/anime/35759/Sidonia_no_Kishi__Ai_Tsumugu_Hoshi,7.44,"After the Earth was destroyed by mysterious alien lifeforms known as the Gauna, surviving remnants of the human race escaped to space in the enormous generation ship Sidonia. Having drifted through space for millennia, the Sidonia found itself once more under attack from Gauna for the first time in a century.

Once again facing the threat of extinction, a temporary victory against the Gauna was eked out thanks to the human-Gauna hybrid Tsumugi Shiraui and ace Guardian mech pilot Nagate Tanikaze.

10 years later... The people of Sidonia enjoy a brief respite. Peaceful days pass, during which Tsumugi begins to realize her feelings for Nagate, who is now celebrated as a hero of Sidonia. However, as Captain Kobayashi has always known, as long as the Gauna remain, peace cannot last.

The decision is made: a final battle, upon which rests the fate of humanity's last survivors. As the end approaches, will the crew be able to protect those they love?

(Source: Polygon Pictures)",1,"Jun 4, 2021",,"['Action', 'Sci-Fi', 'Mecha', 'Space', 'Seinen']"
Simoun,,https://myanimelist.net/anime/879/Simoun,7.44,"In the peaceful theocracy of Simulicram, everyone is born female. At age 17, each maiden undergoes a special ceremony where she chooses her sex. However, only Pairs of maiden priestesses can synchronize with the ancient flying ships known as Simoun needed to defend Simulicram. These Pairs refrain from undergoing the ceremony as long as they wish to keep piloting their Simoun.

Aer is recruited to be a Simoun pilot after a terrifying attack by an enemy nation decimates the squadron known as Chor Tempest. To earn her wings she needs to find her way into the heart of Neviril, Regina of Chor Tempest. But Neviril's heart still belongs to her previous Pair, lost in the battle when she attempted a forbidden Simoun maneuver.

(Source: Media Blasters)",26,"Apr 4, 2006 to Sep 26, 2006",Spring 2006,"['Drama', 'Fantasy', 'Girls Love', 'Military']"
Sora no Otoshimono Forte,Heaven's Lost Property Forte,https://myanimelist.net/anime/8407/Sora_no_Otoshimono_Forte,7.44,"Sakurai Tomoki has settled into his life with the two angeloids, Ikaros and Nymph, and is enjoying himself immensely.  However, he keeps having weird dreams and asks all of his friends to help him investigate the cause.

Nymph conjures up a device that enables people, but not angeloids, to enter other people's dreams.  The device malfunctions at first but eventually they get to what was supposed to be Tomoki's dream but discover that something is very wrong with it.

Later, a meteor comes crashing down from the skies at the site of the large cherry blossom tree where Tomoki first discovered Ikaros.  An extremely well endowed blonde angeloid with a huge sword emerges from the meteor and sets off in search of Tomoki!",12,"Oct 2, 2010 to Dec 18, 2010",Fall 2010,"['Comedy', 'Fantasy', 'Romance', 'Sci-Fi', 'Ecchi', 'Harem', 'Shounen']"
