title_name,title_english,url,score_label,description,episodes,aired,premiered,genres
Mardock Scramble: The First Compression,,https://myanimelist.net/anime/8100/Mardock_Scramble__The_First_Compression,7.42,"Rune Balot is a down-and-out teen prostitute in Mardock City. One day, she's picked up by an ambitious casino manager named Shell who gives her everything she could want. Renewed by a false innocence, a false past, and now the false life Shell has given her, Balot feels grateful. However, she can't help but be curious about why he's done so much for her, so she does some research about his past on a computer. This turns out to be a mistake which will change her life greatly. When Shell finds out what she's done, he attempts to burn her to death by blowing up her car.

Due to the high crime rate in Mardock, a new law called ""Scramble 09"" has given police carte blanche to take extreme and otherwise illegal measures to revive crime witnesses. With this in mind, they allow a professor to bring Balot back from the brink of death by reassembling her entire body with reinforced synthetic fiber. When she finally wakes up, her confused mental state eventually turns toward revenge as Shell is revealed as her killer.

(Source: Nippon Cinema)",1,"Oct 8, 2010",,"['Action', 'Sci-Fi', 'Psychological']"
Mugen no Juunin: Immortal,Blade of the Immortal,https://myanimelist.net/anime/39806/Mugen_no_Juunin__Immortal,7.42,"Manji is an infamous swordsman in feudal Japan who is known as the ""Hundred Man Killer,"" as he has killed one hundred innocent men. However, there is something far more frightening than his ominous reputation: the fact that he is immortal. This is the handiwork of eight-hundred-year-old nun Yaobikuni, who placed bloodworms capable of healing almost any wound in Manji's body.

To atone for his crimes, Manji resolves to kill one thousand evil men. Yaobikuni agrees to this proposal, saying that if he succeeds, she will undo his curse of immortality. Soon after this promise, Manji meets Rin Asano, a 16-year-old girl who requests Manji's assistance in killing those who slaughtered her parents.

Initially reluctant, Manji refuses Rin's desperate plea. However, owing to her evident lack of strength, Manji changes his mind and agrees to protect Rin for four years. With this partnership set in stone, the two embark on a perilous journey of bloodshed, vengeance, and redemption, each to fulfill their own life's cause.

[Written by MAL Rewrite]",24,"Oct 10, 2019 to Mar 26, 2020",,"['Action', 'Adventure', 'Drama', 'Supernatural', 'Gore', 'Historical', 'Martial Arts', 'Samurai', 'Seinen']"
Mugen no Ryvius,Infinite Ryvius,https://myanimelist.net/anime/593/Mugen_no_Ryvius,7.42,"The year is AD 2225. Kouji Aiba and Aoi Housen are serving as astronauts in-training in Liebe Delta which is located on the edge of the Geduld Sea. When saboteurs with unknown intents suddenly strike during a routine dive procedure, the space station plummets into the Geduld, a plasma field that links all the planets like a nervous system and crushes any ship that strays too far into it. With all the adults onboard killed, the young astronauts will have to survive this long journey home in midst of the growing tension amongst each other. Meanwhile the organizers of the sabotage look on and prepare to attack once more.",26,"Oct 6, 1999 to Mar 29, 2000",Fall 1999,"['Award Winning', 'Drama', 'Sci-Fi', 'Mecha', 'Military', 'Psychological', 'Space']"
Naruto: Shippuuden Movie 4 - The Lost Tower,Naruto Shippuden the Movie 4: The Lost Tower,https://myanimelist.net/anime/8246/Naruto__Shippuuden_Movie_4_-_The_Lost_Tower,7.42,"Led by Yamato, Naruto Uzumaki, Sakura Haruno, and Sai are assigned to capture Mukade, a rogue ninja who is pursuing the ancient chakra Ryuumyaku located underneath the Rouran ruins. While the Ryuumyaku has been sealed by the Fourth Hokage, the group fails to prevent Mukade from releasing its power. Consequently, a strong energy burst engulfs both Naruto and Yamato before they can escape.

As he awakens in a magnificent yet hostile kingdom, Naruto meets its young queen Saara and three Konohagakure ninjas on a top-secret mission. They reveal to him that he has time-traveled to Rouran 20 years into the past! To make matters worse, Mukade has already infiltrated the royal court, becoming the naive queen's most trusted minister under the alias Anrokuzan.

Joining forces with the three ninjas, Naruto must protect Saara's life without fail to stop the villain's plans and return to the present.

[Written by MAL Rewrite]",1,"Jul 31, 2010",,"['Action', 'Adventure', 'Fantasy', 'Time Travel', 'Shounen']"
Pokemon Evolutions,Pokémon Evolutions,https://myanimelist.net/anime/49730/Pokemon_Evolutions,7.42,"An animated series created to celebrate 25 years of the global entertainment franchise. Each episode will take fans on a journey through all the known regions of the Pokémon world.

(Source: Anilist)",8,"Sep 9, 2021 to Dec 23, 2021",,"['Adventure', 'Fantasy', 'Kids']"
Pretty Rhythm: Aurora Dream,,https://myanimelist.net/anime/10257/Pretty_Rhythm__Aurora_Dream,7.42,"Aira Harune, a clumsy yet happy-go-lucky girl, is suddenly dragged into the popular world of Prism Shows—an idol show based on figure skating, where performers called ""Prism Stars"" wear outfits encased in Prism Stones and perform stylistic Prism Jumps. Captivated by the dazzling fashion and gorgeous Prism Jumps, Aira decides to become a Prism Star herself.  

She soon encounters the hot-headed Rizumu ""Rhythm"" Amamiya, who desires to perform the legendary Prism Jump “Aurora Rising”; as well as the prideful Mion Takamine, who dreams of becoming the brightest Prism Star above the rest. The journey of these girls is marked by friendship, growth, and unexpected encounters. Can they perform Prism Jumps high enough to reach their dreams and become the next Prism Queens?

[Written by MAL Rewrite]",51,"Apr 9, 2011 to Mar 31, 2012",Spring 2011,"['Sports', 'Idols (Female)', 'Music']"
Saki: Zenkoku-hen,Saki: The Nationals,https://myanimelist.net/anime/16123/Saki__Zenkoku-hen,7.42,"Saki Miyanaga, along with the rest of Kiyosumi High School's mahjong team, proceeds to the national level of the Interhigh Mahjong Championship. However, reaching the top will prove difficult as she faces opponents on par with and, quite possibly, exceeding her skills. Even so, she refuses to back down, vowing to stop at nothing to fulfill her goal: to see her sister face-to-face once more.

[Written by MAL Rewrite]",13,"Jan 6, 2014 to Apr 7, 2014",Winter 2014,"['Slice of Life', 'School', 'Strategy Game', 'Seinen']"
Sakurako-san no Ashimoto ni wa Shitai ga Umatteiru,Beautiful Bones -Sakurako's Investigation-,https://myanimelist.net/anime/30187/Sakurako-san_no_Ashimoto_ni_wa_Shitai_ga_Umatteiru,7.42,"When Shoutarou Tatewaki first meets Sakurako Kujou, he knows his life will never be the same. Initially believing her to be responsible for a disappearance in the neighborhood, he later learns of her true talent: analyzing bone specimens. Sakurako has quite the collection of reconstructed animal bones, but she wishes she had more of the human variety, much to the chagrin of those around her.

Soon, Shoutarou begins accompanying the eccentric osteologist on the many different unsolved cases she comes across—usually in the form of decomposing bodies. But with so many incidents happening around them, could there be a larger mystery at work in their lives?

Sakurako-san no Ashimoto ni wa Shitai ga Umatteiru is a story of two unlikely partners, each showing in their own way that bones can tell how one died, but only people can tell how they lived.

[Written by MAL Rewrite]",12,"Oct 8, 2015 to Dec 24, 2015",Fall 2015,"['Drama', 'Mystery', 'Suspense']"
Shonan Junai Gumi!,Young GTO,https://myanimelist.net/anime/1913/Shonan_Junai_Gumi,7.42,"Eikichi Onizuka and Ryuji Danma are members of infamous biker duo, the Oni Baku. When not out riding around, they can be found in school, trying to pick up young women. This is the story of the young Onizuka, who would later become the greatest teacher in Japan, and his partner Ryuji in their quest to lose their virginity and reach maturity.

They are widely feared bosozoku, and are known for their tenacity and viciousness in a fight. However, this lifestyle does not exactly endear them to the opposite gender, so they decide to change their ways. However, this is easier said than done.

(Source: ANN)",5,"Jan 21, 1994 to Jan 24, 1997",,"['Action', 'Comedy', 'Delinquents', 'School']"
Kuroshitsuji II Specials,Black Butler II Specials,https://myanimelist.net/anime/9136/Kuroshitsuji_II_Specials,7.41,"According to the Kuroshitsuji website, there are 6 OVAs included in the DVD releases.

DVD 2: Ciel in Wonderland (Part 1)
This re-imagines the cast of Kuroshitsuji II as characters in Lewis Carroll's Alice in Wonderland story.

DVD 3: Welcome to the Phantomhive's
This is meant to be like a simulation game. Elizabeth invites a lady (perhaps the viewer) to join her at a ball held at the Phantomhive mansion.

DVD 5: The Making of Kuroshitsuji II
This is a Hollywood style documentary with behind the scenes interviews with Sebastian, Ciel, Claude and Alois etc.

DVD 6: Ciel in Wonderland (Part 2)
This re-imagines the cast of Kuroshitsuji II as characters in Lewis Carroll's Alice in Wonderland story.

DVD 8: The Tale of William the Shinigami
William and Grell have to train new shinigami and reminisce about when they were training partners.

DVD 9: The Spider's Intention
The life in Trancy household and how those work under Alois is caring for him.",6,"Oct 27, 2010 to May 25, 2011",,"['Comedy', 'Supernatural', 'Parody', 'Shounen']"
Level E,,https://myanimelist.net/anime/9834/Level_E,7.41,"Tokyo-born schoolboy Yukitaka Tsutsui is moving to Yamagata Prefecture for high school on a baseball scholarship. Since he went to the top middle school in Japan for baseball, the townsfolk are very excited about his arrival. However, when he arrives in his apartment, he encounters a strange man nonchalantly reading and wearing his clothes! The stranger claims to be an alien who crash-landed on Earth and has nowhere to go. Revealing himself to be Baka Ki El Dogra, the crown prince of the planet Dogra, he is just one of the hundreds of aliens that have already made Earth their home.

Despite his regal origins, the prince is an infamous intergalactic fool who thinks nothing of inconveniencing others for his own amusement. Whether he is running ridiculous tests on his subordinates, giving strange powers to random children, or just generally being a nuisance, nobody is safe from the idiot prince's antics!

[Written by MAL Rewrite]",13,"Jan 11, 2011 to Apr 5, 2011",Winter 2011,"['Comedy', 'Sci-Fi', 'Gag Humor', 'Shounen']"
Love Live! School Idol Project,,https://myanimelist.net/anime/15051/Love_Live_School_Idol_Project,7.41,"Otonokizaka High School is in a crisis! With the number of enrolling students dropping lower and lower every year, the school is set to shut down after its current first years graduate. However, second year Honoka Kousaka refuses to let it go without a fight. Searching for a solution, she comes across popular school idol group A-RISE and sets out to create a school idol group of her own. With the help of her childhood friends Umi Sonoda and Kotori Minami, Honoka forms μ's (pronounced ""muse"") to boost awareness and popularity of her school.

Unfortunately, it's all easier said than done. Student council president Eri Ayase vehemently opposes the establishment of a school idol group and will do anything in her power to prevent its creation. Moreover, Honoka and her friends have trouble attracting any additional members. But the Love Live, a competition to determine the best and most beloved school idol groups in Japan, can help them gain the attention they desperately need. With the contest fast approaching, Honoka must act quickly and diligently to try and bring together a school idol group and win the Love Live in order to save Otonokizaka High School.

[Written by MAL Rewrite]",13,"Jan 6, 2013 to Mar 31, 2013",Winter 2013,"['Slice of Life', 'Idols (Female)', 'Music', 'School']"
Mahou Shoujo Lyrical Nanoha,Magical Girl Lyrical Nanoha,https://myanimelist.net/anime/76/Mahou_Shoujo_Lyrical_Nanoha,7.41,"Nanoha Takamachi, an ordinary third-grader who enjoys spending time with her family and friends, rescues an injured ferret that she had dreamed about the night before. The next day, the ferret cries out to her telepathically, asking Nanoha to save him. The ferret reveals himself to be Yuuno Scrya, a mage from another world who is trying to collect the dangerous 21 Jewel Seeds that he accidentally scattered across the world. He enlists Nanoha's help, gifting her the magical wand Raising Heart, and teaches her how to become a powerful mage.

Days later, after reclaiming a few of the Jewel Seeds, another mage appears: Fate Testarossa. Stronger than Nanoha, Fate refuses to divulge her reasons in trying to collect the Jewel Seeds. Nanoha senses a melancholy in her eyes, but Fate refuses to communicate. Directed by Akiyuki Shinbo, Mahou Shoujo Lyrical Nanoha is a story about the clash of emotions when goals collide.

[Written by MAL Rewrite]",13,"Oct 3, 2004 to Dec 26, 2004",Fall 2004,"['Action', 'Comedy', 'Drama', 'Fantasy', 'Mahou Shoujo']"
Mai-HiME,My-Hime,https://myanimelist.net/anime/98/Mai-HiME,7.41,"While taking a ferry to Fuuka Academy, new students Mai Tokiha and her sickly younger brother, Takumi, spot a girl adrift on the water. Shortly after bringing her aboard, the ferry comes under attack from an assailant who summons a mechanical monster. Despite still recovering from her injuries, Mikoto Minagi fends off the monster using a supernatural sword.

Mai soon discovers that Mikoto is a fellow Fuuka Academy student with abilities called HiME (Highly-advanced Materializing Equipment). Female students with HiME are responsible for defending the academy and the local city from the monstrous ""Orphans."" After several incidents at the school involving battles against these mysterious creatures, Mai learns that she is a HiME herself and is capable of summoning a Child, a mechanical creature capable of great utility and firepower.

Now burdened with new responsibilities, Mai joins 12 other HiME as they safeguard the school from a threat they know little about all while protecting the ones closest to them.

[Written by MAL Rewrite]",26,"Oct 1, 2004 to Apr 1, 2005",Fall 2004,"['Action', 'Fantasy', 'Girls Love', 'Mahou Shoujo', 'School']"
Meitantei Conan Magic File 3: Shinichi to Ran Mahjong Pai to Tanabata no Omoide,Detective Conan Magic File 3: Shinichi and Ran - Memories of Mahjong Tiles and Tanabata,https://myanimelist.net/anime/6231/Meitantei_Conan_Magic_File_3__Shinichi_to_Ran_Mahjong_Pai_to_Tanabata_no_Omoide,7.41,Another Shinichi and Ran pre-story.,1,"Apr 18, 2009",,"['Mystery', 'Shounen']"
Mieruko-chan,,https://myanimelist.net/anime/48483/Mieruko-chan,7.41,"Miko Yotsuya's eyes water as she fixates on a single spot on her phone—she ignores yet another dreadful, horrific monster that is in her face, uttering the disturbing words: ""Can you see me?"" Before now, Miko enjoyed her unassuming high school days, with late-night horror shows serving only as a form of entertainment. But ever since one fateful day, she is the only person aware of the invisible monsters walking freely among humans.

Courageously, Miko makes a bold decision: she will never, under any condition, acknowledge the presence of the horrid specters. However, even though she pretends they do not exist, she can still see how they disturb the people around her, especially her best friend, the energetic and lovely Hana Yurikawa. In order to protect them from the monsters' annoyances, Miko gives it her best to continue her school life and avoid every troublesome crisis—even when they scare her to tears. 

[Written by MAL Rewrite]",12,"Oct 3, 2021 to Dec 19, 2021",Fall 2021,"['Comedy', 'Horror', 'Supernatural', 'School']"
Mitsuboshi Colors,,https://myanimelist.net/anime/35078/Mitsuboshi_Colors,7.41,"Residing within Tokyo's district of Ueno are the Colors, three individuals who protect their city by performing good deeds and aiding their community. Or, at the very least, they pretend to be the city's defenders. In reality, the Colors are just three young girls: the shy Yui Akamatsu, the noisy Sacchan, and the video game-loving Kotoha, who spend their time playing make-believe and exploring the city. The Colors' activities are facilitated by the grandfatherly Daigorou ""Pops"" Kujiraoka, who uses his store's inventory of knick-knacks to entertain the rambunctious trio.

Not everyone is a fan of the Colors though. The local policeman Saitou just wants to deal with his regular duties, but he often finds himself the target of the Colors' attention, having been made the villain in most of their fantasies. But despite his personal feelings, Saitou always finds the time to go along with the three girls' games. Even though the Colors do not actually defend Ueno, they definitely help brighten everyone's day.

[Written by MAL Rewrite]",12,"Jan 7, 2018 to Mar 25, 2018",Winter 2018,"['Slice of Life', 'CGDCT', 'Iyashikei', 'Shounen']"
Pokemon Legends Arceus: Yuki Hodo Kishi Futaai,Pokémon: Hisuian Snow,https://myanimelist.net/anime/51145/Pokemon_Legends_Arceus__Yuki_Hodo_Kishi_Futaai,7.41,"The anime tells the story of a boy named Akio and his encounter with a Hisuian Zorua. When he was younger, Akio's father taught him that people and Pokémon cannot live together. But Akio's interactions with the Zorua might offer a different lesson.

(Source: The Pokémon Company)",3,"May 18, 2022 to Jun 22, 2022",,"['Action', 'Adventure', 'Fantasy', 'Kids']"
Pokemon XY: Mega Evolution,Pokémon: Mega Evolution Special,https://myanimelist.net/anime/23301/Pokemon_XY__Mega_Evolution,7.41,"Previously an assistant of Miare City's Professor Platane, Alain and his Lizardon set off on a journey to become even stronger, by mastering the powers of mega evolution. Investigating the mysteries of this phenomenon, at the behest of the enigmatic Fleur-de-lis, Alain and Lizardon travel across Kalos and Hoenn in search of capable trainers who can use mega evolution in order to improve, as well as help Fleur-de-lis with his research. Along the way, they meet a young girl named Manon who, with her Harimaron, decide to accompany Alain, to which he reluctantly agrees.

Pokemon XY: Mega Evolution follows Alain and Lizardon in their journey to become the strongest users of mega evolution, while also fighting against legendary monsters to protect the ambitions of Fleur-de-lis as well as the safety of those most important to him.

[Written by MAL Rewrite]",4,"Apr 3, 2014 to Oct 29, 2015",,"['Action', 'Adventure', 'Comedy', 'Fantasy', 'Kids']"
Ranma ½: Kessen Tougenkyou! Hanayome wo Torimodose!,Ranma ½: The Movie 2 - The Battle of Togenkyo: Rescue the Brides!,https://myanimelist.net/anime/792/Ranma_½__Kessen_Tougenkyou_Hanayome_wo_Torimodose,7.41,"Ranma and the gang are invited to a boating trip with Kuno. Unfortunately, a storm destroys the yacht and everyone is stranded on a remote island. The whole situation goes even more awry when one by one, the girls disappear without a trace. Ranma then finds out that the girls are abducted by Toma, ruler of the island, as part of his personal harem.

(Source: ANN)",1,"Aug 1, 1992",,"['Adventure', 'Comedy', 'Magical Sex Shift', 'Shounen']"
Rozen Maiden,,https://myanimelist.net/anime/64/Rozen_Maiden,7.41,"Traumatized by school, Jun Sakurada spends his days at home as a shut-in, purchasing things online, only to send them back before the free trial period ends. So when a note appears on his desk, asking whether or not he would wind something, he assumes it was something he ordered and carelessly circles ""yes,"" changing his life forever.

A box arrives with a wind up doll inside, but this is no ordinary toy: after Jun winds her up, she begins walking and talking as if a normal person. With a haughty attitude, she introduces herself as Shinku, the fifth doll in the Rozen Maiden collection, a group of special dolls made by the legendary dollmaker Rozen. These sisters must battle each other in a competition called the Alice Game with the help of a human to ensure victory. The winner becomes Alice, a real girl who is worthy of meeting their creator.

As more sentient dolls end up taking residence in Jun's house, and a foe from Shinku's past makes her appearance, Jun's life becomes far more complicated than he ever thought possible.

[Written by MAL Rewrite]",12,"Oct 8, 2004 to Dec 24, 2004",Fall 2004,"['Action', 'Comedy', 'Drama', 'Fantasy', 'Seinen']"
Sakigake!! Otokojuku,Charge!! Men's Private School,https://myanimelist.net/anime/2903/Sakigake_Otokojuku,7.41,"Otokojuku: a private school for juvenile delinquents that were previously expelled from normal schools. At this school, Japanese chivalry is taught through feudal and military fundamentals. Similar to an action film, the classes are overwhelmed by violence. Only those who survive it become true men.

(Source: ANN)",34,"Feb 25, 1988 to Nov 14, 1988",Winter 1988,"['Action', 'Comedy', 'Delinquents', 'Martial Arts', 'School', 'Shounen']"
Salaryman Kintarou,,https://myanimelist.net/anime/1608/Salaryman_Kintarou,7.41,"The story follows Kintaro, former leader of a widely feared and respected biker gang, who decides that its time to ""straighten out"" and become a ""salaryman"" since his wife died and he has to take care of his young son.

(Source: AniDB)",20,"Feb 18, 2001 to Mar 18, 2001",Winter 2001,"['Comedy', 'Drama', 'Martial Arts', 'Seinen']"
Sayonara Zetsubou Sensei Jo: Zetsubou Shoujo Senshuu,,https://myanimelist.net/anime/3674/Sayonara_Zetsubou_Sensei_Jo__Zetsubou_Shoujo_Senshuu,7.41,"A special summary episode of the first season of Sayonara Zetsubou Sensei, focusing on seven of the girls: Komori Kiri, Matoi Tsunetsuki, Kobushi Abiru, Kimura Kaere, Kitsu Chiri, Sekiuchi ""Maria"" Tarou and Hitou Nami.

Note: This entry also includes the 24 minute version which aired on BS11.",1,"Jan 1, 2008",,"['Comedy', 'Gag Humor', 'Parody', 'School', 'Shounen']"
Seijo no Maryoku wa Bannou desu Season 2,The Saint's Magic Power is Omnipotent Season 2,https://myanimelist.net/anime/51215/Seijo_no_Maryoku_wa_Bannou_desu_Season_2,7.41,"The king of Slantania has officially appointed Sei Takanashi as the Holy Saint—an omnipotent maiden summoned from another world to save the kingdom. After months of relentless fighting against monsters, Sei can finally relax and continue her study at the Medicinal Flora Research Institute. Although her relationship with Albert Hawke, the commander of the Third Order of Knights, gradually blossoms, her bachelorette status attracts unwanted attention from other men—much to Albert's dismay.

Moreover, Tenyuu—one of the many princes from the faraway Zaidera Empire—has taken an interest in Slantania and its powerful healing potions. Given that Sei's identity is a national secret, she must lay low in the royal palace until Tenyuu satisfies his curiosity at the institute and returns to his country. Despite his unimpressive appearance, the foreign prince is far from clueless. He has come to Slantania for a clear reason, and Sei's unique skills may just hold the answer to his cryptic research.

[Written by MAL Rewrite]",12,"Oct 3, 2023 to Dec 19, 2023",Fall 2023,"['Fantasy', 'Romance', 'Isekai', 'Medical']"
Senyuu. 2,,https://myanimelist.net/anime/18523/Senyuu_2,7.41,"When a hole opened up in the world and monsters flooded out, humanity prepared for the demon lord Rukimedes' rise once again. However, even the gravity of this situation cannot impede the antics of straight man hero Alba Frühling and sadist soldier Ross.

Ross, trapped within a plane between two worlds due to Januar Ein's magic, encounters the demon lord taking a nap and looking far too comfortable in his confinement. Simultaneously, Alba, once again in prison, has been sidelined in favor of his eccentric companion's hijinks.

Although separated, Ross and Alba continue their attempts to prevent the demon lord's resurgence, but unbeknownst to them, a ghost from Ross' past may just threaten their quest's success.

[Written by MAL Rewrite]",13,"Jul 3, 2013 to Sep 25, 2013",Summer 2013,"['Action', 'Comedy', 'Fantasy', 'Parody', 'Shounen']"
Shinreigari,Ghost Hound,https://myanimelist.net/anime/2596/Shinreigari,7.41,"Strange things are happening around the town of Suiten. The daughter of a priest begins to see strange visions, spirits have started to roam the mountains, and Tarou Komori is having unsettling dreams. Due to the trauma of being kidnapped 11 years ago, he has repressed most of the memories that could shed light on what really happened all those years ago. But they return in his sleep, combined with encounters beyond the realm of dreams.

As the supernatural and psychological collide, three children struggle to face their demons and repair the breach between the spiritual and corporeal worlds.

[Written by MAL Rewrite]",22,"Oct 18, 2007 to Apr 4, 2008",Fall 2007,"['Mystery', 'Supernatural', 'Suspense', 'Psychological']"
